리뷰,rep,index,Processing,평가
일요일 아침에 방문하여 조용해서 좋았습니다.,3,260,"['일요일', '아침', '방문', '하다', '조용하다', '좋다']",긍정
"사이클링, 조깅을 하는 사람들이 간혹 보였습니다.",4,260,"['사이클링', '조깅', '하다', '사람', '간혹', '보이다']",긍정
"텐트,돗자리2,무릎담요,트레이(베드용 크기) 렌트 종일권pm7시까지 15000원에 가성비 굿이네요",0,261,"['텐트', '돗자리', '무릎', '담요', '트', '레이', '베드', '용', '크기', '렌트', '종일', '권', 'pm', '7시', '15000원', '가성', '비', '굿', '이네', '요']",긍정
이곳은 운동하기 좋은곳 입니다,0,262,"['곳', '은', '운동', '하다', '좋다', '곳', '이다']",긍정
요즘같은 날씨에 선선하니 딱 가기 좋습니다ㅎㅎ,0,263,"['요즘', '날씨', '선선', '하다', '가기', '좋다', 'ㅎㅎ']",긍정
적당히 힐링에 도움이 되는 곳이니 다들 한번쯤은 가보시는게 좋을것같아욥,1,263,"['적당하다', '힐링', '도움', '되다', '곳', '이니', '다', '들다', '한번', '쯤', '은', '가보다', '좋다', '욥']",긍정
사람많은것만 빼면 너무 좋은 곳.,0,264,"['사람', '많다', '빼다', '너무', '좋다', '곳']",긍정
외국인도 많고 가족단위도 많음.,1,264,"['외국인', '도', '많다', '가족', '단위', '도', '많다']",부정
공연도 있고 간단한 음식도 사먹을 수 있음.,2,264,"['공연', '도', '간단하다', '음식', '도', '사먹다', '수']",긍정
편의점은 바가지니 미리 사서 가는걸 추천.,3,264,"['편의점', '은', '바가지', '니', '미리', '사서', '가다', '추천']",긍정
맛난게 많아요~,0,265,"['맛', '난', '게', '많다']",긍정
주차는 복잡,1,265,"['주차', '는', '복잡']",부정
서울의 멋진 야경을 감상할 수 있는 곳.,0,266,"['서울', '멋지다', '야경', '감상', '하다', '수', '곳']",긍정
"여의도 한강 공원에서 밤도깨비야시장(주말 운영), 편의점 등 편리한 시설과 쾌적한 환경에서 도심 속 휴식을 즐길 수 있었습니다.",1,266,"['여의도', '한강', '공원', '밤', '도깨비', '야시장', '주말', '운영', '),', '편의점', '편리하다', '시설', '쾌적하다', '환경', '도심', '속', '휴식', '즐기다', '수']",긍정
걷고 힐링하기 딱 좋은 곳입니다ㅎ,0,267,"['걷다', '힐링', '하다', '좋다', '곳', '이다', 'ㅎ']",긍정
코로나 때문에 사람들이 많이 모여있으면 안 되는데 넘 사람들이 많다.,0,268,"['코로나', '때문', '사람', '많이', '모이다', '안', '되다', '넘다', '사람', '많다']",부정
자전거 빌려서 타기도 좋고 경치가 너무 좋아요.,0,269,"['자전거', '빌리다', '타', '기도', '좋다', '경치', '너무', '좋다']",긍정
날씨 좋은 날 친구 연인 가족들과 나들이 나오면 너무 좋아요,1,269,"['날씨', '좋다', '날', '친구', '연인', '가족', '나들이', '나오다', '너무', '좋다']",긍정
날씨도 좋고 점심시간에 산책하기 좋네요 ㅎㅎ,0,270,"['날씨', '도', '좋다', '점심시간', '산책', '하다', '좋다', 'ㅎㅎ']",긍정
무더운여름날 아이들에게 물놀이할수있는 좋은장소 ^^ 굿 ~,0,271,"['무덥다', '여름날', '물놀이', '하다', '좋다', '장소', '^^', '굿']",긍정
넓고 한적하고 돗자리깔고 누우면 소풍온거같아서 너무좋네요,0,272,"['넓다', '한적하다', '돗자리', '깔다', '누우', '면', '소풍', '오다', '너무', '좋다']",긍정
공중으로 펴져나가는 불꽃-향연 분비는 인파들의 움직임 참말로 기분이 들썽 좋았담니다.^,0,273,"['공중', '펴다', '나가다', '불꽃', '향연', '분비', '는', '인파', '움직임', '참말', '기분', '들썽', '좋다', '담다', '.^']",긍정
-^~⚘,1,273,"['-^~', '⚘']",부정
"사람 엄청 많음 ,주말 금토 야시장 개장 시에는 주차대기 시간이 상당함 배달존도 있고 푸드트럭 이용도 재밌음",0,274,"['사람', '엄청', '많다', '주말', '금토', '야시장', '개장', '시', '에는', '주차', '대기', '상당하다', '배달', '존', '도', '푸드', '트럭', '이용도', '재밌다']",긍정
날씨가추울때거나 더울때여도 각자만에 매력이있어요,0,275,"['날씨', '가추', '울', '거나', '덥다', '도', '만에', '매력']",긍정
노을질때도예쁘고  야경은더예쁜곳이죠,1,275,"['놓다', '도', '예쁘다', '야경', '은', '더', '예쁘다', '곳', '죠']",긍정
모두들  음식드시고 쓰레기만잘치웁시다,2,275,"['음식', '들다', '쓰레기', '만', '자다', '치우다']",부정
여의도 한강공원은 여의나루역에서 접근 가능한 정말 좋은공원입니다 ㅎ,0,276,"['여의도', '한강', '공원', '은', '여의나루역', '접근', '가능하다', '정말', '좋다', '공원', '이다', 'ㅎ']",긍정
여의도 한강공원 불꽃축제,0,277,"['여의도', '한강', '공원', '불꽃', '축제']",긍정
좋아요!!,0,278,"['좋다', '!!']",긍정
한강도좋구 2주차장은사람많아요!!,1,278,"['한', '강도', '좋다', '주차장', '은', '사람', '많다', '!!']",긍정
3주차장은 한적합니다!ㅎ,2,278,"['주차장', '은', '한적하다', 'ㅎ']",긍정
자주 가는곳.,0,279,"['자주', '가다', '곳']",부정
갈때마다 느끼는거지만 초밥진열이 성의가 없다~고 느껴집니다.,1,279,"['갈다', '마다', '느끼다', '초밥', '진열', '성의', '없다', '고', '느껴지다']",긍정
빨리 안채워지고 다 흐트러지고 없어질때까지 기다렸다가 줍니다.,2,279,"['빨리', '안', '채우다', '다', '흐트러지', '고', '없어지다', '기다리다', '줍다']",부정
오직 불만은 그거하나!,3,279,"['불만', '은', '그거']",부정
그런데 저는 그게 제일 중요합니다.,4,279,"['는', '그게', '제일', '중요하다']",부정
그럼에도 불구하고 스프와 커피는 맛 짱!,5,279,"['그렇다', '불구', '하고', '스프', '커피', '는', '맛', '짱']",긍정
마라톤하러 가면 꼭 여의도 공원인데 이렇게 많은 사람을 통솔하는건 정말 어려운 일인것같은데 꼭 해내덥니다 새벽부터 감사합니다,0,280,"['마라톤', '하다', '가면', '꼭', '여의도', '공원', '인데', '이렇게', '많다', '사람', '통솔', '하다', '정말', '어렵다', '이다', '꼭', '해내다', '덥다', '새벽', '감사하다']",긍정
깨끗하고 푸른색 많아 맘것 걸을 수 있어 행복지수 뿜뿜!!!,0,281,"['깨끗하다', '푸른색', '많다', '맘것', '걸', '수', '행복지수', '뿜뿜', '!!!']",긍정
한강을 바라보며 자전거를 타니 너무 상쾌했다.,0,282,"['한강', '바라보다', '자전거', '너무', '상쾌하다']",긍정
하지만 쓰레기 냄새가 조금 났다.,1,282,"['쓰레기', '냄새', '나다']",부정
재미있었다,2,282,['재미있다'],긍정
3일간  잘다녀왔습니다,0,283,"['3일', '간', '잘', '다녀오다']",긍정
주인분들이  너무친절하여  너무행복한  휴가  되였습니다,1,283,"['주인', '분들', '너무', '친절하다', '너무', '행복하다', '휴가', '되다']",긍정
금성 민박  짱,2,283,"['금성', '민박', '짱']",긍정
자유가 넘치는 곳!,0,284,"['자유', '넘치다', '곳']",긍정
그런데 쓰레기는 좀 가지고 갑시다!,1,284,"['쓰레기', '는', '가지', '고', '가다']",부정
텐트를 대여하여 방문했습니다.,0,285,"['텐트', '대여', '하다', '방문', '하다']",긍정
"법이 바뀌어서 한강공원 내에 텐트를 설치할 수 있는 구역과 시간, 규칙이 정해져 있기 때문에 잘 알아보시고 가는 편이 좋아요. (오후7시까지 설치가능, 설치 시 두 면 이상 개방)",1,285,"['법', '바뀌다', '한강', '공원', '내', '텐트', '설치', '하다', '수', '구역', '규칙', '정해지다', '때문', '자다', '알아보다', '가다', '편이', '좋다', '오후', '7시', '설치', '가능', '설치', '시', '두', '면', '개방']",긍정
한강중에 사람도 많고 먹거리도많고 텐트허용구간 따로있어서 좋음,0,286,"['한강', '중', '사람', '도', '많다', '먹거리', '도', '많다', '텐트', '허용', '구간', '따로', '좋다']",긍정
자전거타기좋음,1,286,"['자전거타기', '좋다']",긍정
가을밤에 즐겁게 산책하기 좋은 최적의 조건.,0,287,"['가을', '밤', '즐겁다', '산책', '하다', '좋다', '최적', '조건']",긍정
음식판매가 너무 많은 것은 아쉬움.,1,287,"['음식', '판매', '너무', '많다', '은', '아쉬움']",부정
주차장만 좀 넓고 날씨만 좋으면 ..좋아요,0,288,"['주차장', '만', '넓다', '날씨', '만', '좋다', '..', '좋다']",긍정
돗자리 깔고 치맥먹기좋음.,0,289,"['돗자리', '깔다', '치맥', '먹기', '좋다']",긍정
편의점 라면은 웨이팅시간이 웬만한 맛집 웨이팅시간 뺨치므로 치킨에 만족하는게 좋음.,1,289,"['편의점', '라면', '은', '웨이', '팅', '웬만하다', '맛집', '웨이', '팅', '뺨', '치다', '치킨', '만족하다', '좋다']",긍정
가벼운 원터치텐트 칠수있으나 문은 개방 해두어야함,2,289,"['가볍다', '원', '터치', '텐트', '치다', '문', '은', '개방', '해', '두다', '야하다']",긍정
돛자리 대여료 평균 2천원에 보증금 2천원.,3,289,"['돛자리', '대여', '료', '평균', '2천원', '보증금', '2천원']",부정
언제가도좋은한강변.,0,290,"['언', '가도', '좋다', '은한', '강변']",긍정
9월셋째일욜이 딱 나들이하기좋은 날이었다,1,290,"['9월', '셋째일욜이', '나들이', '하다', '좋다', '날다']",부정
정말 좋습니다.,0,291,"['정말', '좋다']",긍정
편의점에 먹거리도 다양하고 계단에 앉아서 보는 한강뷰는 일품,1,291,"['편의점', '먹거리', '도', '다양하다', '계단', '앉다', '보다', '한강', '뷰', '는', '일품']",긍정
코로나로인해 야외로 나가는일이 많고 날씨도 너무좋은요즈음..,0,292,"['코로나', '인하다', '야외', '나가다', '일이', '많다', '날씨', '도', '너무', '좋다', '요즈음', '..']",긍정
돗자리나 의자는 필수로 가져가시는게 좋습니다^^,1,292,"['돗자리', '의자', '는', '필수', '가져가다', '좋다', '^^']",긍정
좋아요.,0,293,['좋다'],긍정
코로나 조금 수그러들었다고 야시장준비하고 있네요ㅋ,1,293,"['코로나', '수', '그렇다', '들다', '야시장', '준비', '하고', 'ㅋ']",긍정
"편의점,화장실도 여기저기 있고.",2,293,"['편의점', '화장실', '도', '여기저기']",긍정
한강들 중에 젤 좋은듯합니다ㅎㅎ,3,293,"['한강', '중', '젤', '좋다', '듯', '하다', 'ㅎㅎ']",긍정
공원이 넒고 산책하기좋음,0,294,"['공원', '넒', '고', '산책', '하다', '좋다']",긍정
야경멋있어요,1,294,"['야경', '멋있다']",긍정
너무 좋아요~,0,295,"['너무', '좋다']",긍정
야경이  멋진 ~~~ 낮에는 산책하기 좋은,0,296,"['야경', '멋지다', '~~~', '낮', '에는', '산책', '하다', '좋다']",긍정
"자주 오는 공원이지만, 서울에서 제일 편한 장소입니다.",0,297,"['자주', '오다', '공원', '서울', '제일', '편하다', '장소', '이다']",긍정
"걸으며, 생각하며, 자연을 음미하면서 즐기는 장소입니다.",1,297,"['걸다', '생각', '하다', '자연', '음미', '하다', '즐기다', '장소', '이다']",긍정
자전거타고 종종 오는곳~ 요즘같은 가을에 딱 좋아요~~~,0,298,"['자전거', '타고', '종종', '오는', '곳', '요즘', '가을', '좋다', '~~~']",긍정
만원이면 돗자리 텐트 (저녁7시까지)대여가능해요.,1,298,"['만원', '이면', '돗자리', '텐트', '저녁', '7시', '대여', '가능하다']",부정
배달해먹으면서 주말보내기 넘 좋아요♡,2,298,"['배달', '하다', '먹다', '주말', '보내다', '넘다', '좋다', '♡']",긍정
"십여년만에 갔는데, 예전의 가족적이고 한적하던 곳이 젊음의 활기로 가득해져 있었다.",0,299,"['십여', '만에', '가다', '예전', '가족', '적', '이고', '한적하다', '곳', '젊음', '활기', '가득하다']",긍정
"곳곳에 돗자리를 펴고 앉아 간단한 간식과 알콜을 펼쳐놓고, 젊음을 즐기고 있다.",1,299,"['곳곳', '돗자리', '펴다', '앉다', '간단하다', '간식', '알콜', '펼치다', '젊음', '즐기다']",긍정
매우 생소한 광경이다.,2,299,"['매우', '생소하다', '광경', '이다']",부정
과연 이러한 곳이 있었던가.,3,299,"['이러하다', '곳']",부정
언젠가 티비에서 한강공원에 펼친 텐트의 사방을 다 막는 것을 금지하는 규칙을 추진한다는 뉴스를 들은 기억이 난다.,4,299,"['티비', '한강', '공원', '펼치다', '텐트', '사방', '다', '막다', '금지', '하다', '규칙', '추진', '한다는', '뉴스', '들다', '기억', '나다']",긍정
왜 그러는지 알 것 같은 주말 저녁의 풍경이었다.,5,299,"['그렇다', '알', '주말', '저녁', '풍경', '이다']",부정
서울에 봄이 오니 여의도한강공원에 사람들이 많이 나왔네요.,0,300,"['서울', '봄', '오니', '여의도', '한강', '공원', '사람', '많이', '나오다']",부정
자전거 전용도로가 있어 좋구요..,1,300,"['자전거', '전용', '도로', '좋다', '..']",긍정
시원한 강바람 맞으며 강만 쳐다봐도 좋았습니다 😊…,2,300,"['시원하다', '강바람', '맞다', '강', '만', '쳐다보다', '좋다', '😊']",긍정
아직까지는 조금 지저분하지만 옛날에 비해서는 청소인력이 정말 많아진거같아요,0,301,"['아직', '까지는', '지저분하다', '옛날', '비', '하다', '청소', '인력', '정말', '많아지다']",긍정
최대한 청결유지하는거같아서 좋아요,1,301,"['최대한', '청결', '유지', '하다', '좋다']",긍정
배달음식 잘시켜먹을수있도록 배달존 활용도 정말 좋았어요,2,301,"['배달', '음식', '잘', '먹다', '배달', '존', '활용', '도', '정말', '좋다']",긍정
한강공원에서 마포대교 아래가 가장 갬성있고 좋네요,0,302,"['한강', '공원', '마포대교', '아래', '가장', '개다', '성', '좋다']",긍정
10시 넘어도 많이 춥지 않으면 타코야끼도 팔고 닭꼬치도 파네요.,0,303,"['10시', '넘다', '많이', '추다', '않다', '타코야끼', '도', '팔고', '닭꼬치', '도', '파네', '요']",부정
"마실도 좋고, 자전거 타기도 좋습니다.",1,303,"['말다', '좋다', '자전거', '타', '기도', '좋다']",긍정
한강공원에서 불꽃놀이 봤어요,0,304,"['한강', '공원', '불꽃놀이', '보다']",부정
맑은 날 자전거 타고 산책하기 좋은 곳 A great place for a bike ride on a sunny day,0,305,"['맑은', '날', '자전거', '타고', '산책', '하다', '좋다', '곳', 'A', 'great', 'place', 'for', 'a', 'bike', 'ride', 'on', 'a', 'sunny', 'day']",긍정
"한강몽땅 축제에 탱고 공연  잘 보았구요, 마포대교 남단 밑에 밥차에 스파게티와 리조트 너무 맛있었어요~~",0,306,"['한강', '몽땅', '축제', '탱고', '공연', '자다', '보다', '마포대교', '남단', '밑', '밥차', '스파게티', '리조트', '너무', '맛있다', '~~']",긍정
RAWKICHIN 베리굿,1,306,"['RAWKICHIN', '베리', '굿']",긍정
마침 외국인 가족이 방문했는데 한복쇼도 하고 날씨도 좋고 아주 좋았네요,0,307,"['마침', '외국인', '가족', '방문', '하다', '한복', '쇼', '도', '하다', '날씨', '도', '좋다', '아주', '좋다']",긍정
가을이라 그런지 여름 보다 사람이 더 많고 좋네요,0,308,"['가을', '이라', '그렇다', '여름', '보다', '사람', '더', '많다', '좋다']",긍정
11시쯤 되니 사람들도 많이 빠지구요,1,308,"['11시', '쯤', '되다', '사람', '도', '많이', '빠지다']",부정
이보다 좋을수 없죠,0,309,"['이보', '다', '좋다', '없다']",긍정
모두  소중한 한강을  위해 기본 원칙을 잘 지키며 자연과 함께 하길 바래요!!,1,309,"['소중하다', '한강', '위해', '기본', '원칙', '자다', '지키다', '자연', '하다', '바', '래', '요', '!!']",긍정
신당동 떡볶이 머고 오는 길에 오랜만에 한강~~,0,310,"['신당동', '떡볶이', '머', '고', '오다', '길', '오랜', '만', '한강', '~~']",긍정
당산역에서 한우고기 맛나게 먹고 여의도 한강공원 여의나루역 까지 걸으며 다른 도시에 와 있는 착각하고 힐링하고 왔네요 😀…,0,311,"['당산역', '한우', '고기', '맛', '나다', '먹다', '여의도', '한강', '공원', '여의나루역', '걸다', '도시', '오다', '착각', '하고', '힐링', '하고', '오다', '😀']",긍정
2인 자전거를 타면 참 좋습니다,0,312,"['인', '자전거', '차다', '좋다']",긍정
연인과 오면 좋을 거 같네요,1,312,"['연인', '오다', '좋다', '거']",긍정
저는 친구랑 와서 좀 2인 자전거 타는데 알 수 없는 시선을 좀 받았는데 친구랑 타도 그냥 웃기고 재미있긴 해요,2,312,"['는', '친구', '랑', '오다', '인', '자전거', '알', '수', '없다', '시선', '받다', '친구', '랑', '타도', '그냥', '웃기', '고', '재미있다', '해', '요']",긍정
한강변 야경을 즐기기 좋은 밤유람선관광!최고!!,0,313,"['한', '강변', '야경', '즐기다', '좋다', '밤', '유람선', '관광', '최고', '!!']",긍정
2017년 12월 야시장 개장.,0,314,"['2017년', '12월', '야시장', '개장']",부정
볼거리보다는 먹거리가 더 눈에 띄는 곳.,1,314,"['볼거리', '보다는', '먹거리', '더', '눈', '띄다', '곳']",부정
다양한 푸드 트럭들이 입을 즐겁게 해줌.ㅎㅎㅎ,2,314,"['다양하다', '푸드', '트럭', '입', '즐겁다', '해주다', 'ㅎㅎㅎ']",긍정
처음 가봤는데 사람들 진짜 많네요,0,315,"['처음', '가보다', '사람', '진짜', '많다']",부정
커플 천국.,1,315,"['커플', '천국']",긍정
저같은 솔로는 마음가짐 단디하고 가야 ㅋㅋㅋ,2,315,"['솔로', '는', '마음가짐', '단디', '하고', '가야', 'ㅋㅋㅋ']",부정
BTS페스타 갔다왔는데 너무 더웠지만 재밌었어요,0,316,"['BTS', '페스', '타', '가다', '오다', '너무', '덥다', '재밌다']",긍정
한강을 끼고 있는 공원 중에서는 제일 넓고 편한 곳인듯 하다.,0,317,"['한강', '끼', '고', '공원', '중', '에서는', '제일', '넓다', '편하다', '곳', '인', '듯', '하다']",긍정
다양한 사람들이 한데 어울려 있는 곳.,1,317,"['다양하다', '사람', '어울리다', '곳']",긍정
가끔씩 큰 행사도 하여 사람도 많이 몰린다.,2,317,"['가끔', '씩', '크다', '행사', '도', '하다', '사람', '도', '많이', '몰리다']",긍정
깨긋하고 일단 관광명소로 정말 유명한 곳입니다.,0,318,"['깨', '긋다', '관광명소', '정말', '유명하다', '곳', '이다']",긍정
여의나루역에서 바로 우측으로 가시면 바로 한강 공원이 보입니다.,1,318,"['여의나루역', '우측', '가시', '면', '한강', '공원', '보이다']",부정
거기서 돋자리는 10000원 정도 합니다.,2,318,"['거기', '서', '돋다', '자리다', '10000원', '정도', '하다']",부정
대여료로 여러가지 주니 패키지 잘 사서 가세요.,3,318,"['대', '료', '여러가지', '주니', '패키지', '자다', '사서', '가세', '요']",긍정
볼거리가 너무 많아서 좋아요,0,319,"['볼거리', '너무', '많다', '좋다']",긍정
먹을것도 많아요,1,319,"['먹다', '많다']",긍정
"요약: 먹고, 쉬고, 놀기 좋은 뷰 좋은 한강공원",0,320,"['요약', ':', '먹다', '쉬', '고', '놀다', '좋다', '뷰', '좋다', '한강', '공원']",긍정
코로나전에 가고 몇년만에 갔는데 많이 바껴서 시간보내기 좋아요.,0,321,"['코로나', '전', '가다', '만에', '가다', '많이', '바', '끼다', '보내다', '좋다']",긍정
서울살이를 포기 못하는 이유중 하나.,0,322,"['서', '울', '살이', '포기', '못', '하다', '이유', '중']",부정
언제가도 한강을 힐링의 스팟이고 마음이 편해지는 곳인것 같아요.,1,322,"['언', '가도', '한강', '힐링', '스팟', '이고', '마음', '편하다', '곳', '인']",긍정
이쁜건 덤♡ 커플지옥이긴 하지만 누구랑 가든 혼자 가든 정말 좋은 장소인것 같아요.,2,322,"['이쁘다', '덤', '♡', '커플', '지옥', '이기다', '랑', '가든', '가든', '정말', '좋다', '장소', '인']",긍정
낮이고 밤이고 사랑스러운 장소♡,3,322,"['낮', '이고', '밤', '이고', '사랑스럽다', '장소', '♡']",긍정
도심속에 한강이 있다는것 자체가 행운이죠,0,323,"['도심', '속', '한강', '자체', '행운', '죠']",부정
지하철역에서 바로 접근할수 있는 여의도한강공원 접근성과 편의시설이 잘 되어있어 이용이 편리합니다,1,323,"['지하철역', '접근', '하다', '여의도', '한강', '공원', '접근성', '편의', '시설', '자다', '되어다', '이용', '편리하다']",긍정
서울에서 편안하게 가족끼리 휴식을 가질수있는곳 입니다~^^,0,324,"['서울', '편안하다', '가족', '끼리', '휴식', '가지다', '곳', '이다', '~^^']",긍정
피크닉 구역편의점 및 기타 편의시설이 잘되어있습니다,1,324,"['피크닉', '구역', '편의점', '편의', '시설', '잘', '되어다']",긍정
사람들이 정말많고 피크닉장소인가?는 정말 돗자리 깔고 먹는 사람들 많음.,0,325,"['사람', '정말', '많다', '피크닉', '장소', '인가', '늘다', '정말', '돗자리', '깔다', '먹다', '사람', '많다']",긍정
멋진 서을의 야경과 금요일 토요일 저녁엔 밤도깨비 시장이 열려요.,0,326,"['멋지다', '서다', '야경', '금요일', '토요일', '저녁', '엔', '밤', '도깨비', '시장', '열리다']",긍정
집에서 가까워서 자주 들리는 곳이예요.,1,326,"['집', '가깝다', '자주', '들리다', '곳', '예요']",부정
누구에게나 추천할 만한 곳이예요.,2,326,"['에게나', '추천', '하다', '만', '한', '곳', '예요']",긍정
"날씨 좋은 날 가족과 연인, 친구들 잔디밭에 텐트 쳐놓고 즐거운 시간 보냄",0,327,"['날씨', '좋다', '날', '가족', '연인', '친구', '잔디밭', '텐트', '치다', '즐겁다', '보내다']",긍정
치맥은 필수 한강공원에서 사면 비싸니 미리 음식 준비해가삼,1,327,"['치맥', '은', '필수', '한강', '공원', '사면', '비싸다', '미리', '음식', '준비', '하다']",긍정
날이 추워서 그런지 사람 많이 없고 소풍하기에 딱 좋은것같아요~,0,328,"['날', '춥다', '그렇다', '사람', '많이', '없다', '소풍', '하다', '좋다']",긍정
1. 서울 사람은 친절하다.,0,329,"['서울', '사람', '은', '친절하다']",부정
2. 저녁에 가면 텐트촌 없음.,1,329,"['저녁', '가면', '텐트', '촌', '없다']",긍정
여의도 근처에 텐트 대여소 있음.,2,329,"['여의도', '근처', '텐트', '대', '여소']",부정
3. 야경 직인다!,3,329,"['야경', '직', '인', '다']",부정
와!,4,329,['오다'],부정
63빌딩!,5,329,"['63', '빌딩']",긍정
(걸어서 갈 수 있음. 오래 걸림),6,329,"['걸다', '갈다', '수', '오래', '걸리다']",부정
4. 밤중인데도 분수대에서 물 나옴.,7,329,"['밤중', '인데', '도', '분수', '대', '물', '나오다']",긍정
물낭비 오진다!,8,329,"['물', '낭비', '오다']",부정
5. 평일에도 버스킹 있음.,9,329,"['평일', '에도', '버스킹']",긍정
6. 편의점 있음.,10,329,['편의점'],부정
7. 화장실 많음.,11,329,"['화장실', '많다']",긍정
이용자가 많아서 위생 상태는 별로임.,12,329,"['이용자', '많다', '위생', '상태', '는', '별로', '임']",부정
8. 자전거 대여소 있음.,13,329,"['자전거', '대', '여소']",긍정
"경치가 그렇게 좋은 곳도 아니고, 더워 죽겠는데 치킨은 한참 기다리다가 목 빠져서 죽는 줄 알았습니다.",0,330,"['경치', '그렇게', '좋다', '곳도', '아니다', '덥다', '죽다', '치킨', '은', '한참', '기다리다', '목', '빠지다', '죽다', '줄', '알다']",부정
그나마 맛있으면 됐을 텐데 맛있기는 커녕 기름쩐내가 심해서 배고팠는데 제대로 먹지도 못했습니다.,1,330,"['그나마', '맛있다', '돼다', '텐데', '맛있다', '커녕', '기름쩐내', '심하다', '배고프다', '제대로', '먹다', '못', '하다']",부정
절대 가지 마세요.,2,330,"['절대', '가지', '말다']",부정
100% 후회합니다.,3,330,"['100%', '후회', '하다']",부정
반려견 산책과 한가로운 시간,0,331,"['반려견', '산책', '한가롭다']",부정
여의도 불꽃놀이 축제,0,332,"['여의도', '불꽃놀이', '축제']",부정
외국부럽지않은 한강공원 너무 시원하고 버스킹 노래도 넘 좋아요,0,333,"['외국', '부럽다', '않다', '한강', '공원', '너무', '시원하다', '버스킹', '노래', '도', '넘다', '좋다']",긍정
다만 맥주먹으면 화장실이 대란..,1,333,"['맥주', '먹다', '화장실', '대란', '..']",긍정
긴 줄에 깜놀..이에요,2,333,"['기다', '줄', '깜놀', '..', '이에요']",부정
만개한 갖가지 꽃을 실껏 보고왔어요~,0,334,"['만', '개', '한', '갖가지', '꽃', '실껏', '보고오다']",부정
