리뷰,rep,index,Processing,평가
전체적으로 넓고 쾌적합니다.,1,747,"['전체', '적', '넓다', '쾌적하다']",긍정
가족이 가기에 좋고요.,2,747,"['가족', '가기', '좋다']",긍정
주차도 수월합니다.,3,747,"['주차', '도', '수월하다']",긍정
단지 주말 2~3시에는 차가 빽빽하게 주차되어 있어 주차장에서 나가기가 쉽지 않습니다.,4,747,"['주말', '2~3시', '에는', '차갑다', '빽빽하다', '주차', '되어다', '주차장', '나가다', '쉬다', '않다']",긍정
아이들이 뛰어놀기 좋아요.,0,748,"['뛰어놀다', '좋다']",긍정
요즘은 노점상들이 많이 생겨서 먹거리가 많아졌네요.,1,748,"['요즘', '은', '노점상', '많이', '생기다', '먹거리', '많아지다']",긍정
다만 거리가 지저분해지고 있는 것 같아서 멋진 풍경을 기대하기는 힘들어요.,2,748,"['거리', '지저분하다', '멋지다', '풍경', '기대하다', '힘들다']",긍정
오픈라이더 한강 몽탕한바퀴 다녀왔어요,0,749,"['오픈', '라이더', '한강', '몽탕하다', '바퀴', '다녀오다']",긍정
이날 비가많이 와서 쓰러질뻔,1,749,"['날', '비', '많이', '오다', '쓰러지다', '뻔']",부정
편의점 주차장 화장실 간이샤워시설에 선착장 선상카페 탁트인 공원 가까이에 63빌딩 가족이나 단체 모임하기 너무 좋아요.,0,750,"['편의점', '주차장', '화장실', '간이', '샤워', '시설', '선착장', '선상', '카페', '탁트인', '공원', '가까이', '63', '빌딩', '가족', '이나', '단체', '모임', '하다', '너무', '좋다']",긍정
여의나루역도 옆에!^^,1,750,"['여의나루역', '도', '옆', '!^^']",긍정
"220917 기존 남녀화장실중 몇개는 여성전용화장실로 변경됨, 간만에 마라톤대회로 여의나루역 옆에 주차장이 금방 만차됨, 이 경우 63빌딩 아래 한강주차장에 주차하는게 좋음",2,750,"['220917', '기존', '남녀', '화장실', '중', '몇개', '는', '성', '전용', '화장실', '변경', '되다', '간만', '마라톤', '대회', '여의나루역', '옆', '주차장', '금방', '만', '차', '되다', '경우', '63', '빌딩', '아래', '한강', '주차장', '주차', '하다', '좋다']",긍정
한강때문에 서울산다는말 나옵니다,0,751,"['한강', '때문', '서', '울산', '달다', '나오다']",부정
개업때부터 다니던 고기집인데요~,0,752,"['개업', '다니다', '고기', '지다']",부정
직원분들 넘 친절하시고 고기도 넘 부드럽고 맛있어서 늘 애용하고 있습니다^^,1,752,"['직원', '분들', '넘다', '친절하다', '고기', '도', '넘다', '부드럽다', '맛있다', '늘', '애용', '하고', '^^']",긍정
북적북적 사람 냄새가 나서 좋았습니다,0,753,"['북적', '북적', '사람', '냄새', '나서다', '좋다']",긍정
밤에는 야시장이 최고,0,754,"['밤', '에는', '야시장', '최고']",긍정
사람은 거어어어업나게 많지만 배달도 잘 되어있고 한강뷰도 좋다.,0,755,"['사람', '은', '거', '어어', '어업', '나다', '많다', '배달', '도', '자다', '되어다', '한강', '뷰', '도', '좋다']",긍정
텐트나 돗자리에서 한적하게 보내고 싶다면 상관없지만 좋은 뷰를 보고 싶다면 조금 서두를 필요가 있다.,1,755,"['텐트', '돗자리', '한적하다', '보내다', '싶다', '상관없다', '좋다', '뷰', '보고', '싶다', '서두르다', '필요']",긍정
미세먼지와 부분적으로 움푹 파인 데가 있다는 점은 아쉽다.,2,755,"['미세먼지', '부분', '적', '움푹', '파이다', '데', '점', '은', '아쉽다']",긍정
"어디에 자리 잡든 옆에 사람은 꼭 있으니, 한적한 곳을 찾고 싶다면 그냥 주차장에 있어야 한다.",3,755,"['자리', '잡다', '옆', '사람', '은', '꼭', '한적하다', '곳', '찾다', '싶다', '그냥', '주차장', '하다']",부정
"베스트는 뷰 좋고, 땅도 평탄하며, 주변이 시끄럽지도 않고, 사람들의 주 이동동선에 있지 않아 붐비지 않고, 화장실과의 거리가 부담스럽지 않는 곳.",4,755,"['베스트', '는', '뷰', '좋다', '땅', '도', '평탄하다', '주변', '시끄럽다', '않다', '사람', '주', '동', '동선', '않다', '붐비다', '않다', '화장실', '과의', '거리', '부담', '스럽지', '않다', '곳']",긍정
밤에가면 시원하구넘조음 해먹있는데 짱편해요,0,756,"['밤', '가면', '시원하다', '넘다', '조음', '해먹', '짱', '편하다']",긍정
주차장도 공영이라 많이 나오지 않아 좋습니다,0,757,"['주차장', '도', '공영', '이라', '많이', '나오다', '않다', '좋다']",긍정
편의점 즉석요리를 먹어도 분위기 탓인지 맛 있습니다,1,757,"['편의점', '즉석요리', '먹다', '분위기', '탓', '인지', '맛']",긍정
몇년 전부터 배달 오토바이가 언까지 진입을 못해서 위험한 부분은 많이 줄었습니다,2,757,"['전', '배달', '오토바이', '언', '진입', '못', '하다', '위험하다', '부분', '은', '많이', '줄다']",부정
날라다니는?,3,757,"['나르다', '다니다']",부정
자전거만 조심하시면,4,757,"['자전거', '만', '조심하다']",긍정
암것도 안하고 쉬기 딱 좋음,0,758,"['암', '도', '안', '하고', '쉬다', '좋다']",긍정
넓지만 편의점에 사람이 많다 주변에서 미리 장을 보는게 좋고 차는 안타는게 낫다,0,759,"['넓다', '편의점', '사람', '많다', '주변', '미리', '장', '보다', '좋다', '차다', '안', '낫다']",긍정
늘만원주차장임,1,759,"['늘', '만원', '주차', '장임']",부정
코로나 좀 나아지고 날씨따뜻해서 그런지 생각보다 사람이 많네요.,0,760,"['코로나', '나아지다', '날씨', '따뜻하다', '그렇다', '생각', '보다', '사람', '많다']",긍정
주차장 출차시 대기줄이 길 정도.,1,760,"['주차장', '추다', '차다', '대다', '길', '정도']",부정
편의점에 핫초코 먹으러 갔는데 뜨거운물 줄이 이렇게 길 줄이야.,2,760,"['편의점', '핫초코', '먹다', '가다', '뜨겁다', '물', '줄이다', '이렇게', '길', '줄', '이야']",부정
그냥 나왔어요 ㅠㅠ,3,760,"['그냥', '나오다', 'ㅠㅠ']",부정
여의도한강공원 멀티프라자..,0,761,"['여의도', '한강', '공원', '멀티', '프라자', '..']",긍정
공연장 입니다.,1,761,"['공연장', '이다']",긍정
양질의 컨텐츠로 꾸며진 각종 공연이 이루어집니다.,2,761,"['양질', '컨텐츠', '꾸미다', '공연', '이루어지다']",긍정
야경이좋고 버스킹도 좋은데 가끔 제한해서 좀..,0,762,"['야경', '좋다', '버스킹', '도', '좋다', '가끔', '제한', '하다', '..']",긍정
4월 벚꽃 보며 걷기 좋음,0,763,"['4월', '벚꽃', '보다', '걷기', '좋다']",긍정
복잡한 생각 정리하기에 좋은장소,0,764,"['복잡하다', '생각', '정리', '하다', '좋다', '장소']",긍정
서울의 상징,0,765,"['서울', '상징']",부정
여의도한강공원 이곳은 대한민국 정치.,0,766,"['여의도', '한강', '공원', '곳', '은', '대한민국', '정치']",긍정
금융.방송의 중심지를 배후에 두고 있다.,1,766,"['금융', '방송', '중심지', '배후', '두다']",부정
"그 옛날 백사장에는 땅콩 밭이 있었으며, 일제강점기인 1916년부터 1917년까지는 여의도비행장이 있었다.",2,766,"['옛날', '백', '사장', '에는', '땅콩', '밭', '일제강점기', '인', '1916년', '1917년', '까지는', '여의도비행장']",긍정
1922년 12월 10일 안창남이 한국인 최초로 5만인파의 환호 속에 시행 비행을 펼쳤다.,3,766,"['1922년', '12월', '10일', '안창남', '한국인', '최초', '5만', '인파의', '환호', '속', '시행', '비행', '펼치다']",부정
"서울시의 한강르네상스사업에 의해 조성된 여의도 한강공원은 한강을 향해 펼쳐진 시원한 물빛광장과 피아 노 물결, 너른 들판, 풀로팅스테이지 외에도 국제여객선 선착장과 요트 마리나를 갗추고 있다.  #",4,766,"['서울시', '한강르네상스', '사업', '의하다', '조성', '되다', '여의도', '한강', '공원', '은', '한강', '향', '하다', '펼쳐지다', '시원하다', '물빛', '광장', '피아', '노', '물결', '너른', '들판', '풀', '팅', '스테이지', '외', '에도', '국제', '여객선', '선착장', '요트', '마리나', '갗추', '고', '#']",긍정
행운과 기쁨을 가져다주는 서울의 상징 해치 #밤섬(율도) #숲지에 관한 람사르 협약 등록지 #누에섬  등,5,766,"['행운', '기쁨', '가져다주다', '서울', '상징', '해치', '#밤섬', '율도', '#숲지에', '관', '한', '람사르', '협약', '등록', '지', '#누에섬']",긍정
넓고 볼거리 먹을거리 많음,0,767,"['넓다', '볼거리', '먹다', '많다']",긍정
사람들 마스크 잘 쓰고 있음,1,767,"['사람', '마스크', '자다', '쓰다']",긍정
여의도에 온다면 이것은 참 좋은 추억이 많은 곳이에요,0,768,"['여의도', '오다', '은', '차다', '좋다', '추억', '많다', '곳', '이에요']",긍정
강릉에서 텐트 치고 놀기 좋고 연인과 함께라면 먹기도 좋고 언제나 반갑게 맞이해 주는 환경이 너무 좋네요,1,768,"['강릉', '텐트', '치고', '놀다', '좋다', '연인', '하다', '먹기', '도', '좋다', '언제나', '반갑다', '맞이', '하다', '주다', '환경', '너무', '좋다']",긍정
그리고 여기서 자전거 대여해서 봄이면 벚꽃이 너무 너무 이쁘게 잘 알아요,2,768,"['서', '자전거', '대여', '하다', '보다', '벚꽃', '너무', '너무', '이쁘다', '자다', '알다']",긍정
그리고 한강 서 먹는 치맥이 얼마나 맛있는지 꼭 드셔 보셔야 돼요,3,768,"['한강', '서다', '먹다', '치맥', '맛있다', '꼭', '들다', '보다', '돼다']",긍정
한강공원 중에는 여의도 한강공원 이 제일 좋은 거 같아요,4,768,"['한강', '공원', '중', '에는', '여의도', '한강', '공원', '제일', '좋다', '거']",긍정
여기에 유람선도 있는데 나중에 꼭 타 보고 싶네요,5,768,"['유람선', '도', '나중', '꼭', '타', '보고', '싶다']",긍정
저렴하더라고요,6,768,['저렴하다'],긍정
거기에서 또 먹고 싶고 부패도 먹고 싶고 어쨌든 강추합니다,7,768,"['거기', '먹다', '싶다', '부패', '도', '먹다', '싶다', '어쨌든', '강', '추하다']",긍정
여름밤 무더위를 피해 분위기를 즐기기에 최적의 장소,0,769,"['여름밤', '무더위', '피해', '분위기', '즐기다', '최적', '장소']",긍정
탁트 윈 한강 따라 산책하거나 자전거를 타기 좋다.,0,770,"['탁트', '윈', '한강', '따르다', '산책', '거나', '자전거', '좋다']",긍정
"코로나가 종식되면 친구나 가족단위로 돗자리깔고, 도시락 까먹기 좋을 듯 싶다.",1,770,"['코로나', '종식', '되다', '친구', '가족', '단', '위로', '돗자리', '깔다', '도시락', '까먹다', '좋다', '듯', '싶다']",긍정
단 사람 많은 주말에 발딛을 틈 없이 많을 것으로 예상된다.,2,770,"['단', '사람', '많다', '주말', '발', '딛다', '틈', '없이', '많다', '예상', '되다']",긍정
처음 보고 너무 아름다워서 놀라 한참동안 바라보고 있었음.,0,771,"['처음', '보고', '너무', '아름답다', '한참', '바라보다']",부정
서울에서 볼 수 있는 아름다운 곳 중에 꼽히는 곳이고 평소 서울과 달리 주말에는 여유를 즐기러 사람들이 많이 찾아옴.,1,771,"['서울', '볼', '수', '아름답다', '곳', '중', '꼽히다', '곳', '이고', '평소', '서울', '달리', '주말', '에는', '여유', '즐기다', '사람', '많이', '찾아오다']",부정
텐트 치거나 돗자리 깔고 배달음식 시켜서 먹기 좋고 배달을 받을 수 있는 구역이 따로 있어서 혼란스럽지 않음.,2,771,"['텐트', '치다', '돗자리', '깔다', '배달', '음식', '먹기', '좋다', '배달', '받다', '수', '구역', '따로', '혼란', '스럽지', '않다']",긍정
또한 전단지를 많이 나눠주는데 전단지 버리는 통도 있는 센스 있어서 놀랐음.,3,771,"['전단지', '많이', '나누다', '전단지', '버리다', '통', '도', '센스']",긍정
사람은 많지만 버스킹도 가끔 하고 여유를 즐기기 정말 좋은 곳임.,4,771,"['사람', '은', '많다', '버스킹', '도', '가끔', '하다', '여유', '즐기다', '정말', '좋다', '곳임']",긍정
벚꽃이 반발 했어요,0,772,"['벚꽃', '반발', '하다']",부정
마눌님과 데이트,1,772,"['마눌', '님', '데이트']",부정
홍콩보다 멋진야경을 감상할 수 있어요,0,773,"['홍콩', '보다', '멋지다', '야경', '감상', '하다', '수']",긍정
뭐 항상 사람 많고 그런데 요즘 7시 이후로 텐트를 치는게 금지되었고 7시 전이라도 텐트를 칠 수 있는 구간이 지정되어 있어서 전과는 다르게 정말 깨끗해져서 좋아요.,0,774,"['뭐', '항상', '사람', '많다', '요즘', '7시', '이후', '텐트', '치다', '금지', '되어다', '7시', '전이', '라도', '텐트', '수', '구간', '지정', '되어다', '전과', '는', '다르다', '정말', '깨끗해지다', '좋다']",긍정
비록 쓰레기는 놀라울 정도로 많지만요.,1,774,"['쓰레기', '는', '정도', '많다', '만요']",부정
각자 가져온 쓰레기 하나라도 꼭 가지고 갑시다..,2,774,"['가져오다', '쓰레기', '라도', '꼭', '가지', '고', '가다', '..']",부정
여의나루역쪽으로 가다보면 쓰레기 버리는데 있으니까요,3,774,"['여의나루역', '쪽', '가다', '보다', '쓰레기', '버리다', '요']",부정
꼭 쓰레기는 쓰레기통에 버립시다.,4,774,"['꼭', '쓰레기', '는', '쓰레기통', '버리다']",부정
언제 가도 힐링이 되는 곳.,0,775,"['가도', '힐링', '되다', '곳']",긍정
벚꽃 시즌에 방문해서인지 사람이 참 많았다.,0,776,"['벚꽃', '시즌', '방문', '하다', '사람', '차다', '많다']",부정
벚꽃도 이쁘게 펴있고 나들이 가기 좋은 공원.,1,776,"['벚꽃', '도', '이쁘다', '펴다', '나들이', '가기', '좋다', '공원']",긍정
갈때마다 느끼지만 최고의 힐링 장소이지 않을까 합니다.,0,777,"['갈다', '마다', '느끼다', '최고', '힐링', '장소', '이지', '않다', '하다']",긍정
아직까지는 날씨 쌀쌀하고 또 지금은 사람이 많은 곳은 최대한 자제해야해서 왠만하면 다음날 휴무일때 새벽즈음에 찾아가고하는데 갈때마다 좋아요,1,777,"['아직', '까지는', '날씨', '쌀쌀하다', '지금', '은', '사람', '많다', '곳', '은', '최대한', '자제', '하다', '하다', '왠만하다', '날', '휴무', '새벽', '즈음', '찾아가다', '갈다', '마다', '좋다']",긍정
멋찜이구요,0,778,"['멋', '찌다']",긍정
깨긋하고  조아요,1,778,"['깨', '긋다', '좋다']",긍정
서늘하게 밤산책하기좋지만 그만큼 사람도 많음,0,779,"['서늘하다', '밤', '산책', '하다', '좋다', '그만큼', '사람', '도', '많다']",긍정
"주말엔 사람이 많아서 오히려 스트레스받을 수 있으니, 평일에 가는걸 추천드립니다.",0,780,"['주말', '엔', '사람', '많다', '스트레스', '받다', '수', '평일', '가다', '추천', '드리다']",긍정
겨울빼고는 돗자리 깔고 힐링하기 좋은곳 입니다.,1,780,"['겨울', '빼다', '돗자리', '깔다', '힐링', '하다', '좋다', '곳', '이다']",긍정
"이곳 토박이로써 추천드리자면 차가있다면 근처 홍대나 합정, 영등포쪽에서 음식을  포장해와서 드시는걸 추천드립니다.",2,780,"['곳', '토박이', '추천', '드리다', '차갑다', '근처', '홍대', '합정', '영등포', '쪽', '음식', '포장', '해오다', '들다', '추천', '드리다']",긍정
배달음식이나 한강에서 파는 음식들은 맛이 너무 없는데다 비싸기까지 해서 기분 망칩니다...,3,780,"['배달', '음식', '이나', '한강', '팔다', '음식', '은', '맛', '너무', '없다', '비싸다', '하다', '기분', '망치다']",부정
또는 편의점 뽀글이+편의점 주전부리가 훨씬 맛있어요,4,780,"['또는', '편의점', '뽀글이', '편의점', '주전부리', '맛있다']",긍정
귀여운 애기들이 많았다.,0,781,"['귀엽다', '애기', '많다']",긍정
열심히 공부하면 좋을텐데.,1,781,"['열심히', '공부', '하다', '좋다']",긍정
그래도 자전거는 재밌게 탔다.,2,781,"['자전거', '는', '재밌다']",긍정
아 그리고 유난 떨기 싫어서 쓰레기 걍 버리구왔는데 앞으로는 쓰레기를 다 집에 가져가도록 하는건 어떨까?,3,781,"['유난', '떨기', '싫다', '쓰레기', '걍', '버리다', '오다', '앞', '으로는', '쓰레기', '다', '집', '가져가다', '하다', '어떻다']",부정
물론 귀찮기는 하다.,4,781,"['귀찮다', '기다', '하다']",긍정
강아지랑 산책하기 딱좋은곳,0,782,"['강아지', '랑', '산책', '하다', '딱좋다', '곳']",긍정
가볍게 맥주한잔 즐기자~^^,0,783,"['가볍다', '맥주', '한잔', '즐기다', '~^^']",긍정
쥐가 너무 많아요.,0,784,"['쥐', '너무', '많다']",부정
서울시는 대책없이 공원에서 쥐를키우나 봅니다.,1,784,"['서울시', '는', '대책', '없이', '공원', '쥐', '키우다', '보다']",긍정
즐거이 놀다 왔습니당,0,785,"['즐거이', '놀다', '오다', '습', '니당다']",긍정
치맥하기 딱 좋은 곳 하지만 사람도 너무 많다,0,786,"['치맥', '하다', '좋다', '곳', '사람', '도', '너무', '많다']",긍정
인생에서 가장 좋아하는 장소.,0,787,"['인생', '가장', '좋아하다', '장소']",긍정
도시라는 복잡한 곳에서 여유를 찾을 수 있는 정말 좋은 장소에요.,1,787,"['도시', '라는', '복잡하다', '곳', '여유', '찾다', '수', '정말', '좋다', '장소', '에요']",긍정
3~10월 정도가 놀기 좋고  특히 11월 초에 하는 불꽃축제..,2,787,"['3~10월', '정도', '놀다', '좋다', '특히', '11월', '초', '하다', '불꽃', '축제', '..']",부정
정말 너무 좋습니다.,3,787,"['정말', '너무', '좋다']",긍정
참고로 불꽃축제 자리는 I SEOUL U 근처가 아닌 63빌딩 바로 옆에서 진행하니 그쪽이서 대기 타시길 바라겠습니다.,4,787,"['참고', '불꽃', '축제', '자리다', 'I', 'SEOUL', 'U', '근처', '아니다', '63', '빌딩', '옆', '진행', '하다', '쪽', '서', '대기', '바라다']",부정
"위치 및 조망 굿, 그래서인지 사람이 너무 많다....",0,788,"['위치', '조', '망', '굿', '래서', '인지', '사람', '너무', '많다', '....']",부정
여의도 한강공원 사람많고 경치는 진짜좋아요,0,789,"['여의도', '한강', '공원', '사람', '많다', '경치', '는', '진짜', '좋다']",긍정
야경맛집인정합니다.,1,789,"['야경', '맛집', '인', '정합', '니', '다']",긍정
다만 돗자리나 이런건 사기꾼같은분들이많아서 그냥 챙겨가시거나 4천원내고 그냥 가진다고 생각하시는게 좋아요,2,789,"['돗자리', '이렇다', '사기꾼', '분', '많다', '그냥', '챙기다', '4천원', '내고', '그냥', '가지다', '생각', '하다', '좋다']",부정
배달음식도 배달구역이 따로있어서 생각보가 안더럽고 깔끔함 진짜 관리잘된다고 느끼고왓어요,3,789,"['배달', '음식', '도', '배달', '구역', '따로', '생각', '보가', '안', '더럽다', '깔끔하다', '진짜', '관리', '잘', '되다', '느끼다', '왓', '요']",긍정
강추합니더,4,789,"['강', '추하다', '더']",긍정
자전거타기 너무 좋습니다.,0,790,"['자전거타기', '너무', '좋다']",긍정
맥주 한캔하며 스트레스 풀기 좋음.,0,791,"['맥주', '한', '캔', '며', '스트레스', '풀기', '좋다']",긍정
걷는것도 좋음.,1,791,"['걷다', '좋다']",긍정
날씨도 좋구 ㅋ  잘놀구왔어요,0,792,"['날씨', '도', '좋다', 'ㅋ', '잘', '놀다', '오다']",긍정
"불꽃 축제, 티비로 보는거랑 완전 달라요.",0,793,"['불꽃', '축제', '티비', '보다', '완전', '달라', '요']",부정
"티비 BGM 하고 현장에서 터지는 폭죽 소리는 비교불가, 전쟁난줄. ...",1,793,"['티비', 'BGM', '하다', '현장', '터지다', '폭죽', '소리', '는', '비교', '불가', '전쟁', '난', '줄']",긍정
사람이 너무 많고 여유롭게 즐길수 있는 공원이 아님.,0,794,"['사람', '너무', '많다', '여유롭다', '즐기다', '공원', '아니다']",부정
잔디밭에 온통 텐트고 쓰레기도 너무 많으며 사이사이 지나다니는 자전거가 정말 위험하다.,1,794,"['잔디밭', '온통', '텐트', '고', '쓰레기', '도', '너무', '많다', '사이사이', '지나다', '자전거', '정말', '위험하다']",부정
거리 음식들은 너무 비쌈.,2,794,"['거리', '음식', '은', '너무', '비싸다']",부정
여의도 한강공원의 메인 스팟에서 대교방향으로 좀만 가도 사람이 매우 적어서 그 쪽을 추천함.,3,794,"['여의도', '한강', '공원', '메인', '스팟', '대교', '방향', '만', '가도', '사람', '매우', '적다', '쪽', '추천', '함']",부정
음식물가가 조금 있는거 치곤 너무 괜찮은 휴식 공간입니다,0,795,"['음식물', '가가', '치다', '너무', '괜찮다', '휴식', '공간', '이다']",긍정
가격은 높아도 만족도 역시 높은,0,796,"['가격', '은', '높다', '만족도', '역시', '높다']",긍정
탁트임 좋아요,0,797,"['탁', '트이다', '좋다']",긍정
가족과 함께 보내기 너무 좋습니다~,0,798,"['가족', '보내다', '너무', '좋다']",긍정
다만 아쉽다면.....,1,798,"['아쉽다', '.....']",부정
거리두기4단계로 그늘막설치가 안되서 아쉽네요...,2,798,"['거리', '두기', '단계', '그늘', '막', '설치', '안되다', '아쉽다']",부정
돗자리펼치고 가족.연인.친구둘과 보내기 너무 좋아요~~^^,3,798,"['돗자리', '펼치다', '가족', '연인', '친구', '보내다', '너무', '좋다', '~~^^']",긍정
사람 많음 먹을거 많음,0,799,"['사람', '많다', '먹다', '많다']",부정
탁트인 공원의 분위기와 잘정돈된 산책로..아이들이 놀기 좋네요.,0,800,"['탁트인', '공원', '분위기', '자다', '정돈', '되다', '산책로', '..', '놀다', '좋다']",긍정
코로나로 인해 예전의 북적거림이 사라진 지금이 공원 방문의 적기인듯 싶네요.,1,800,"['코로나', '인하다', '예전', '북적', '거림', '사라지다', '지금', '공원', '방문', '적다', '싶다']",긍정
근데 비싼 편의점 물가는 마이너스 ㅋ,2,800,"['근데', '비싸다', '편의점', '물가', '는', '마이너스', 'ㅋ']",긍정
코로나가 성행중인데 사람들이 여전히 많아요.,0,801,"['코로나', '성행', '중', '인데', '사람', '여전하다', '많다']",부정
코로나 조심하시구 조금 잠잠해지고 안전해지면 즐기러 가시는걸 추천드려요.,1,801,"['코로나', '조심하다', '잠잠하다', '안전하다', '즐기다', '갈다', '추천', '드리다']",긍정
여름이라서 텐트쳐도 더웠어요.,2,801,"['여름', '이라서', '텐트', '치다', '덥다']",부정
더위도 조심해서 가세요,3,801,"['더위', '도', '조심하다', '가세', '요']",긍정
왜 서울에 살고 싶어 하는지 알게된 개기,0,802,"['서울', '살', '고', '싶다', '하다', '알', '게', '되다', '개다']",부정
자전거 타기가 넘 좋은 넓디넓은 여으도나루굉장  입니다,0,803,"['자전거', '넘다', '좋다', '넓다', '넓다', '이다', '나루', '굉', '장', '이다']",긍정
요즘 시원해서 좋네요,0,804,"['요즘', '시원하다', '좋다']",긍정
돗자리나 자전거 대여 같은 인프라가 좋은편.,0,805,"['돗자리', '자전거', '대여', '인프라', '좋다', '편']",긍정
차없이 가기엔 접근성이 좋습니다.,1,805,"['차', '없이', '가기', '엔', '접근성', '좋다']",긍정
"편의점은 여의도 공원쪽에 하나, 마포대교쪽에 하나, 크루즈 선착장에 하나씩 있습니다.",2,805,"['편의점', '은', '여의도', '공', '원', '쪽', '마포대교', '쪽', '크루즈', '선착장', '씩']",긍정
날씨가 좋은 날에 가기좋다.,0,806,"['날씨', '좋다', '날', '가기', '좋다']",긍정
"어제처럼 날씨가 좋은 날도 드물고 더군다나 벚꽃도 만개하여 너무 아름다웠다. 라면, 치킨과 맥주 먹기에 최고다",1,806,"['어제', '처럼', '날씨', '좋다', '날', '도', '드물다', '벚꽃', '도', '만', '개', '너무', '아름답다', '라면', '치킨', '맥주', '먹기', '최고다']",긍정
마음의 안정감 되찾게된다.,0,807,"['마음', '안정감', '되찾다', '되다']",긍정
분위기 좋고~ 다좋아요~^^,0,808,"['분위기', '좋다', '다', '좋다', '~^^']",긍정
소상공인 여러분~!,1,808,"['소상', '공인', '~!']",긍정
대한민국 관광 발전을 위해 사기는 금지해주시고 친절을 겸비해주시길 부탁 드립니다.,2,808,"['대한민국', '관광', '발전', '위해', '사기', '는', '금지', '해주다', '친절', '겸비', '해주다', '부탁', '드리다']",긍정
특히 외국인들에게요.,3,808,"['특히', '외국인', '요']",긍정
손님 이잖아요~^^;;,4,808,"['손님', '이다', '~^^;;']",긍정
